{
  "schema_version": "v2.0",
  "trip_id": "cli-smoke",
  "title": "Exporter Test Trip",
  "title_local": "导出测试行程",
  "currency_local": "CNY",
  "user_budget": 12000,
  "day_count": 2,
  "start_date": "2026-06-01",
  "end_date": "2026-06-02",
  "legs": [
    {
      "leg_index": 0,
      "city_id": "beijing",
      "city_name": "Beijing",
      "first_day": 1,
      "last_day": 2
    }
  ],
  "travelers": [
    "Matilde",
    "Jade"
  ],
  "last_saved_ts": "2026-05-14T10:00:00+08:00",
  "current_editor_session": null,
  "auto_mode_used": false
}